Item,Content
Topic,"Local Problem Solving (Environment, Welfare, Urban Issues)"
Service Name,AI System-Based Problem-Solving Service for Paju Smart City Welfare and Environment Management
Problem Definition,"Occurrence of citizen-perceived urban problems such as environmental pollution, urban imbalance, and welfare blind spots"
Solution Idea,Early detection and response to environmental/welfare problems through AI sensor and video-based real-time monitoring
Key Technologies,"Object Detection, Predictive Modeling, GIS Visualization, IoT Integration, Dashboard-Based Analysis"
Expected Effects,"Improvement of citizens' quality of life, environmental improvement, enhancement of urban management efficiency, and smart city diffusion"